{
 "version": 1,
 "fps": 30,
 "width": 1080,
 "height": 1920,
 "duration": 14.0,
 "brand": {
  "accent": "#FF3355",
  "ink": "#0D0F12",
  "paper": "#FFFFFF",
  "name": "Michael Sartain",
  "handle": "@michaelsartain"
 },
 "items": [
  {
   "type": "hook",
   "at": 0.0,
   "until": 1.15,
   "hookLines": [
    "THEY COULD HAVE",
    "CALLED THE COPS"
   ],
   "sub": "watch this"
  },
  {
   "type": "lowerthird",
   "title": "MICHAEL Sartain",
   "sub": "Men of Action Podcast",
   "at": 0.4,
   "until": 3.4
  },
  {
   "type": "poster",
   "at": 1.148,
   "until": 2.409,
   "rows": [
    [
     {
      "w": "It's",
      "at": 1.198
     },
     {
      "w": "something",
      "at": 1.357
     },
     {
      "w": "they",
      "at": 1.701
     },
     {
      "w": "could",
      "at": 1.866
     }
    ],
    [
     {
      "w": "have",
      "at": 2.119
     },
     {
      "w": "called",
      "at": 2.189
     }
    ]
   ]
  },
  {
   "type": "poster",
   "at": 2.38,
   "until": 3.568,
   "rows": [
    [
     {
      "w": "the",
      "at": 2.43
     },
     {
      "w": "cops,",
      "at": 2.557
     },
     {
      "w": "but",
      "at": 2.788
     },
     {
      "w": "they",
      "at": 2.948
     }
    ],
    [
     {
      "w": "didn't.",
      "at": 3.018
     }
    ]
   ]
  },
  {
   "type": "poster",
   "behind": true,
   "zone": [
    0.3,
    0.46
   ],
   "heroSize": 340,
   "at": 3.964,
   "until": 5.108,
   "rows": [
    [
     {
      "w": "They",
      "at": 4.014
     },
     {
      "w": "were",
      "at": 4.236
     }
    ],
    [
     {
      "w": "57",
      "at": 4.423,
      "kind": "hero"
     },
     {
      "w": "MEN",
      "at": 4.581,
      "kind": "hero"
     }
    ],
    [
     {
      "w": "in",
      "at": 4.749
     },
     {
      "w": "the",
      "at": 4.888
     }
    ]
   ],
   "connSize": 88
  },
  {
   "type": "poster",
   "at": 4.958,
   "until": 5.343,
   "rows": [
    [
     {
      "w": "group.",
      "at": 5.008
     }
    ]
   ]
  },
  {
   "type": "poster",
   "at": 5.343,
   "until": 6.903,
   "rows": [
    [
     {
      "w": "Okay,",
      "at": 5.393
     },
     {
      "w": "so",
      "at": 5.566
     },
     {
      "w": "that's",
      "at": 5.69
     },
     {
      "w": "the",
      "at": 6.025
     }
    ],
    [
     {
      "w": "first",
      "at": 6.211
     },
     {
      "w": "one.",
      "at": 6.683
     }
    ]
   ]
  },
  {
   "type": "fx",
   "kind": "freeze",
   "at": 6.6,
   "dur": 0.5
  },
  {
   "type": "poster",
   "at": 6.751,
   "until": 8.408,
   "rows": [
    [
     {
      "w": "Guys,",
      "at": 6.801
     },
     {
      "w": "remember,",
      "at": 6.986
     },
     {
      "w": "they",
      "at": 7.777
     },
     {
      "w": "were",
      "at": 8.02
     }
    ],
    [
     {
      "w": "57.",
      "at": 8.188
     }
    ]
   ]
  },
  {
   "type": "poster",
   "at": 8.276,
   "until": 9.387,
   "rows": [
    [
     {
      "w": "This",
      "at": 8.326
     },
     {
      "w": "is",
      "at": 8.471
     },
     {
      "w": "the",
      "at": 8.599
     },
     {
      "w": "first",
      "at": 8.737
     }
    ],
    [
     {
      "w": "claim.",
      "at": 8.995
     }
    ]
   ]
  },
  {
   "type": "poster",
   "at": 9.387,
   "until": 10.507,
   "rows": [
    [
     {
      "w": "They",
      "at": 9.437
     },
     {
      "w": "were",
      "at": 9.569
     },
     {
      "w": "57",
      "at": 9.885
     },
     {
      "w": "men",
      "at": 10.012
     }
    ],
    [
     {
      "w": "in",
      "at": 10.145
     },
     {
      "w": "the",
      "at": 10.287
     }
    ]
   ]
  },
  {
   "type": "poster",
   "at": 10.415,
   "until": 11.416,
   "rows": [
    [
     {
      "w": "group",
      "at": 10.465
     },
     {
      "w": "Every",
      "at": 11.126
     }
    ]
   ]
  },
  {
   "type": "poster",
   "zone": [
    0.62,
    0.74
   ],
   "place3d": {
    "y": 0.68,
    "rotY": -16,
    "rotX": 5,
    "persp": 950,
    "zoom": [
     1.0,
     1.05
    ]
   },
   "at": 11.196,
   "until": 12.81,
   "rows": [
    [
     {
      "w": "chat.",
      "at": 11.246
     },
     {
      "w": "single",
      "at": 11.246
     },
     {
      "w": "one",
      "at": 11.616
     },
     {
      "w": "of",
      "at": 11.916
     }
    ],
    [
     {
      "w": "them",
      "at": 12.057
     },
     {
      "w": "should",
      "at": 12.206
     },
     {
      "w": "have",
      "at": 12.6
     }
    ]
   ]
  },
  {
   "type": "fx",
   "kind": "punch",
   "at": 11.3,
   "dur": 0.35,
   "zoom": 1.05
  }
 ]
}