{
 "version": 1,
 "fps": 30,
 "width": 1080,
 "height": 1920,
 "duration": 21.37,
 "brand": {
  "accent": "#FF3355",
  "ink": "#0D0F12",
  "paper": "#FFFFFF"
 },
 "items": [
  {
   "type": "fx",
   "kind": "opening",
   "at": 0.0,
   "dur": 0.27
  },
  {
   "type": "card",
   "at": 0.0,
   "until": 2.017,
   "bg": "dark",
   "lines": [
    [
     {
      "w": "You",
      "at": 0.0
     },
     {
      "w": "made",
      "at": 0.411
     },
     {
      "w": "one",
      "at": 0.865
     },
     {
      "w": "guy",
      "at": 1.222
     },
     {
      "w": "wait",
      "at": 1.486,
      "kind": "key"
     }
    ]
   ]
  },
  {
   "type": "poster",
   "at": 2.327,
   "until": 3.838,
   "zone": [
    0.7,
    0.86
   ],
   "rows": [
    [
     {
      "w": "guy",
      "at": 2.327
     },
     {
      "w": "not",
      "at": 2.463
     },
     {
      "w": "wait",
      "at": 2.774,
      "kind": "key"
     }
    ],
    [
     {
      "w": "can",
      "at": 3.004
     },
     {
      "w": "you",
      "at": 3.342
     },
     {
      "w": "explain",
      "at": 3.613,
      "kind": "key"
     }
    ]
   ]
  },
  {
   "type": "poster",
   "at": 4.118,
   "until": 5.944,
   "zone": [
    0.7,
    0.86
   ],
   "rows": [
    [
     {
      "w": "why",
      "at": 4.118
     },
     {
      "w": "The",
      "at": 4.714
     },
     {
      "w": "guys",
      "at": 5.034,
      "kind": "key"
     }
    ],
    [
     {
      "w": "there,",
      "at": 5.196,
      "kind": "key"
     },
     {
      "w": "God",
      "at": 5.734
     }
    ]
   ]
  },
  {
   "type": "poster",
   "at": 5.946,
   "until": 7.38,
   "zone": [
    0.7,
    0.86
   ],
   "rows": [
    [
     {
      "w": "didn't",
      "at": 5.946,
      "kind": "key"
     },
     {
      "w": "make",
      "at": 6.3
     },
     {
      "w": "him",
      "at": 6.58
     }
    ],
    [
     {
      "w": "wait.",
      "at": 6.861,
      "kind": "key"
     },
     {
      "w": "I,",
      "at": 7.049
     },
     {
      "w": "I",
      "at": 7.17
     }
    ]
   ]
  },
  {
   "type": "poster",
   "at": 7.491,
   "until": 9.625,
   "zone": [
    0.7,
    0.86
   ],
   "rows": [
    [
     {
      "w": "make",
      "at": 7.491
     },
     {
      "w": "you.",
      "at": 8.051
     },
     {
      "w": "These",
      "at": 8.874,
      "kind": "key"
     }
    ],
    [
     {
      "w": "days",
      "at": 9.177
     },
     {
      "w": "I",
      "at": 9.415,
      "kind": "key"
     }
    ]
   ]
  },
  {
   "type": "poster",
   "at": 9.534,
   "until": 10.77,
   "zone": [
    0.7,
    0.86
   ],
   "rows": [
    [
     {
      "w": "make",
      "at": 9.534
     },
     {
      "w": "everybody",
      "at": 9.68,
      "kind": "key"
     },
     {
      "w": "wait",
      "at": 10.283
     }
    ],
    [
     {
      "w": "just",
      "at": 10.433
     },
     {
      "w": "because",
      "at": 10.56,
      "kind": "key"
     }
    ]
   ]
  },
  {
   "type": "poster",
   "at": 10.963,
   "until": 12.435,
   "zone": [
    0.7,
    0.86
   ],
   "rows": [
    [
     {
      "w": "I'm",
      "at": 10.963
     },
     {
      "w": "the",
      "at": 11.062
     },
     {
      "w": "type",
      "at": 11.178
     },
     {
      "w": "of",
      "at": 11.429,
      "kind": "key"
     }
    ],
    [
     {
      "w": "person",
      "at": 11.545
     },
     {
      "w": "that",
      "at": 11.819
     },
     {
      "w": "I",
      "at": 12.137
     },
     {
      "w": "need",
      "at": 12.225,
      "kind": "key"
     }
    ]
   ]
  },
  {
   "type": "poster",
   "at": 12.374,
   "until": 13.774,
   "zone": [
    0.7,
    0.86
   ],
   "rows": [
    [
     {
      "w": "a",
      "at": 12.374
     },
     {
      "w": "mental",
      "at": 12.461
     },
     {
      "w": "connection",
      "at": 12.825,
      "kind": "key"
     }
    ],
    [
     {
      "w": "before",
      "at": 13.345,
      "kind": "key"
     },
     {
      "w": "you",
      "at": 13.564
     }
    ]
   ]
  },
  {
   "type": "poster",
   "at": 13.725,
   "until": 15.183,
   "zone": [
    0.7,
    0.86
   ],
   "rows": [
    [
     {
      "w": "can",
      "at": 13.725
     },
     {
      "w": "even",
      "at": 13.998
     },
     {
      "w": "turn",
      "at": 14.168,
      "kind": "key"
     }
    ],
    [
     {
      "w": "Turn",
      "at": 14.444
     },
     {
      "w": "me",
      "at": 14.772
     },
     {
      "w": "on.",
      "at": 14.973,
      "kind": "key"
     }
    ]
   ]
  },
  {
   "type": "poster",
   "at": 15.096,
   "until": 16.463,
   "zone": [
    0.7,
    0.86
   ],
   "rows": [
    [
     {
      "w": "So",
      "at": 15.096
     },
     {
      "w": "I",
      "at": 15.474
     },
     {
      "w": "know",
      "at": 15.78,
      "kind": "key"
     }
    ],
    [
     {
      "w": "what",
      "at": 16.012
     },
     {
      "w": "I'm",
      "at": 16.253,
      "kind": "key"
     }
    ]
   ]
  },
  {
   "type": "poster",
   "at": 16.51,
   "until": 17.971,
   "zone": [
    0.7,
    0.86
   ],
   "rows": [
    [
     {
      "w": "looking",
      "at": 16.51,
      "kind": "key"
     },
     {
      "w": "for.",
      "at": 16.983
     },
     {
      "w": "I'm",
      "at": 17.138
     }
    ],
    [
     {
      "w": "not",
      "at": 17.423
     },
     {
      "w": "into",
      "at": 17.761,
      "kind": "key"
     }
    ]
   ]
  },
  {
   "type": "poster",
   "at": 17.934,
   "until": 20.604,
   "zone": [
    0.7,
    0.86
   ],
   "rows": [
    [
     {
      "w": "casual",
      "at": 17.934,
      "kind": "key"
     },
     {
      "w": "stuff.",
      "at": 18.629
     },
     {
      "w": "So",
      "at": 19.201
     }
    ],
    [
     {
      "w": "I'm",
      "at": 19.428
     },
     {
      "w": "I",
      "at": 20.394,
      "kind": "key"
     }
    ]
   ]
  },
  {
   "type": "poster",
   "at": 20.627,
   "until": 21.243,
   "zone": [
    0.7,
    0.86
   ],
   "rows": [
    [
     {
      "w": "can",
      "at": 20.627
     },
     {
      "w": "feel",
      "at": 20.857
     },
     {
      "w": "it.",
      "at": 21.033,
      "kind": "key"
     }
    ]
   ]
  }
 ]
}