{
  "version": 1,
  "fps": 30,
  "width": 1080,
  "height": 1920,
  "duration": 28.8,
  "brand": {
    "accent": "#9BE82E",
    "ink": "#0D0F12",
    "paper": "#FFFFFF"
  },
  "items": [
    {
      "type": "fx",
      "kind": "opening",
      "at": 0.0,
      "dur": 0.27
    },
    {
      "type": "poster",
      "at": 0.01,
      "until": 0.5,
      "rows": [
        [
          {
            "w": "We",
            "at": 0.01
          },
          {
            "w": "have",
            "at": 0.3
          }
        ]
      ]
    },
    {
      "type": "counter",
      "at": 0.45,
      "value": 2500,
      "prefix": "$",
      "label": "FOR THE NEEDS",
      "countDur": 0.85,
      "until": 3.3
    },
    {
      "type": "list",
      "at": 3.3,
      "title": "WHAT ELSE DO WE NEED?",
      "items": [
        {
          "text": "TV",
          "at": 3.3
        },
        {
          "text": "GAMING CONSOLE",
          "at": 3.61
        },
        {
          "text": "BASKETBALL",
          "at": 4.58
        }
      ],
      "until": 5.53
    },
    {
      "type": "poster",
      "at": 5.84,
      "until": 7.02,
      "rows": [
        [
          {
            "w": "We",
            "at": 5.84
          },
          {
            "w": "need",
            "at": 5.94
          },
          {
            "w": "a",
            "at": 6.18
          }
        ],
        [
          {
            "w": "BASKETBALL",
            "at": 6.3,
            "kind": "key"
          },
          {
            "w": "HOOP",
            "at": 6.81
          }
        ]
      ],
      "zone": [
        0.65,
        0.88
      ]
    },
    {
      "type": "pip",
      "at": 7.1,
      "until": 9.35,
      "src": "motion/test_assets/hoop_b.jpg",
      "label": "BASKETBALL HOOP",
      "sub": "for the lounge",
      "illustrative": true
    },
    {
      "type": "chip",
      "at": 9.7,
      "until": 11.3,
      "title": "WANTS CATEGORY",
      "iconSvg": "<svg xmlns='http://www.w3.org/2000/svg' viewBox='0 0 24 24' fill='none' stroke='#0D0F12' stroke-width='2.6' stroke-linecap='round'><circle cx='12' cy='12' r='10' fill='rgba(255,255,255,.35)' stroke='none'/><path d='M9 9l6 6M15 9l-6 6'/></svg>"
    },
    {
      "type": "poster",
      "at": 12.17,
      "until": 13.8,
      "rows": [
        [
          {
            "w": "Okay,",
            "at": 12.17
          },
          {
            "w": "let's",
            "at": 12.46
          },
          {
            "w": "talk",
            "at": 12.77
          }
        ],
        [
          {
            "w": "more",
            "at": 13.09
          },
          {
            "w": "about",
            "at": 13.42
          }
        ]
      ]
    },
    {
      "type": "poster",
      "at": 14.5,
      "until": 15.95,
      "rows": [
        [
          {
            "w": "CRAZY",
            "at": 14.5,
            "kind": "neon"
          },
          {
            "w": "LED",
            "at": 15.14
          },
          {
            "w": "lights.",
            "at": 15.4
          }
        ]
      ]
    },
    {
      "type": "broll",
      "mode": "fullbleed",
      "at": 15.95,
      "until": 17.65,
      "src": "motion/test_assets/led_lounge_b.jpg",
      "label": "LED LIGHTS",
      "sub": "sets the vibe",
      "illustrative": true
    },
    {
      "type": "poster",
      "at": 18.25,
      "until": 19.3,
      "rows": [
        [
          {
            "w": "some",
            "at": 18.25
          },
          {
            "w": "of",
            "at": 18.4
          },
          {
            "w": "those",
            "at": 18.5
          }
        ],
        [
          {
            "w": "in",
            "at": 18.79
          },
          {
            "w": "the",
            "at": 18.95
          },
          {
            "w": "WANTS",
            "at": 19.08,
            "kind": "key"
          }
        ]
      ]
    },
    {
      "type": "poster",
      "at": 19.36,
      "until": 21.45,
      "rows": [
        [
          {
            "w": "Maybe",
            "at": 19.36
          },
          {
            "w": "we",
            "at": 19.61
          },
          {
            "w": "can",
            "at": 19.71
          },
          {
            "w": "even",
            "at": 19.91
          },
          {
            "w": "have",
            "at": 20.06
          },
          {
            "w": "some",
            "at": 20.24
          }
        ],
        [
          {
            "w": "POSTERS",
            "at": 20.43,
            "kind": "key"
          },
          {
            "w": "without",
            "at": 20.79
          },
          {
            "w": "budgeting.",
            "at": 21.06
          }
        ]
      ]
    },
    {
      "type": "process",
      "at": 23.17,
      "title": "THE BUDGET SPLIT",
      "steps": [
        {
          "text": "NEEDS",
          "sub": "$2,500",
          "at": 23.17
        },
        {
          "text": "WANTS",
          "sub": "$1,500",
          "at": 23.98
        },
        {
          "text": "SAVE",
          "sub": "$1,000",
          "at": 25.18
        }
      ],
      "until": 26.13
    },
    {
      "type": "fx",
      "kind": "flare",
      "at": 25.18,
      "dur": 0.267
    },
    {
      "type": "poster",
      "at": 26.54,
      "until": 28.75,
      "rows": [
        [
          {
            "w": "that's",
            "at": 26.54
          },
          {
            "w": "20%",
            "at": 26.85,
            "kind": "key"
          },
          {
            "w": "of",
            "at": 27.1
          },
          {
            "w": "that",
            "at": 27.21
          }
        ],
        [
          {
            "w": "total",
            "at": 27.71
          },
          {
            "w": "BUDGET",
            "at": 28.05,
            "kind": "key"
          }
        ]
      ]
    }
  ]
}